{
  "$schema": "../contracts/experiment.schema.json",
  "schemaVersion": "0.1.0", "apiVersion": "grid-rift/v0",
  "id": "001-tactical-combat", "version": "0.1.0", "title": "Two-lane 3v3 tactical baseline", "status": "draft", "seed": 130363,
  "timing": {"tickRateHz": 20, "maxTicks": 18000, "hashEveryTicks": 20, "snapshotEveryTicks": 200, "maxCommandLeadTicks": 40, "maxCommandAgeTicks": 20},
  "teams": [{"id": "alpha"}, {"id": "beta"}],
  "participants": [
    {"id": "p1", "teamId": "alpha", "archetypeId": "runner", "controller": {"kind": "human", "policyId": "human.mouse-keyboard", "policyVersion": "0.1.0", "decisionIntervalTicks": 1, "reactionTicks": 0, "actionLimitPerTick": 1}},
    {"id": "p2", "teamId": "alpha", "archetypeId": "runner", "controller": {"kind": "local-policy", "policyId": "baseline.utility", "policyVersion": "0.1.0", "decisionIntervalTicks": 4, "reactionTicks": 4, "actionLimitPerTick": 1}},
    {"id": "p3", "teamId": "alpha", "archetypeId": "runner", "controller": {"kind": "local-policy", "policyId": "baseline.utility", "policyVersion": "0.1.0", "decisionIntervalTicks": 4, "reactionTicks": 4, "actionLimitPerTick": 1}},
    {"id": "p4", "teamId": "beta", "archetypeId": "runner", "controller": {"kind": "local-policy", "policyId": "baseline.utility", "policyVersion": "0.1.0", "decisionIntervalTicks": 4, "reactionTicks": 4, "actionLimitPerTick": 1}},
    {"id": "p5", "teamId": "beta", "archetypeId": "runner", "controller": {"kind": "local-policy", "policyId": "baseline.utility", "policyVersion": "0.1.0", "decisionIntervalTicks": 4, "reactionTicks": 4, "actionLimitPerTick": 1}},
    {"id": "p6", "teamId": "beta", "archetypeId": "runner", "controller": {"kind": "local-policy", "policyId": "baseline.utility", "policyVersion": "0.1.0", "decisionIntervalTicks": 4, "reactionTicks": 4, "actionLimitPerTick": 1}}
  ],
  "modules": [
    {"id": "world.planar", "version": "0.1.0", "config": {"width": 160, "depth": 120, "layout": "dual-lane"}},
    {"id": "movement.planar", "version": "0.1.0", "config": {"speed": 6, "bodyRadius": 0.6}},
    {"id": "perception.radius-los", "version": "0.1.0", "config": {"radius": 18, "shareTeamVision": true}},
    {"id": "combat.runner", "version": "0.1.0", "config": {"health": 100, "basicDamage": 10, "basicRange": 8, "basicIntervalTicks": 16, "pulseDamage": 25, "pulseRange": 14, "pulseRadius": 0.6, "pulseSpeed": 24, "pulseWindupTicks": 6, "pulseCooldownTicks": 100, "dashDistance": 6, "dashDurationTicks": 4, "dashCooldownTicks": 120, "respawnTicks": 100}},
    {"id": "objective.relay", "version": "0.1.0", "config": {"zoneCount": 1, "radius": 7, "captureTicks": 60, "scorePerTick": 1, "requirePresence": true}},
    {"id": "lane.skirmish", "version": "0.1.0", "config": {"laneCount": 2, "towersPerTeam": 2, "waveIntervalTicks": 400, "creepsPerWave": 3, "towerHealth": 500, "coreHealth": 1000}},
    {"id": "rules.core-destruction", "version": "0.1.0", "config": {"unlockAfterTowers": 1, "simultaneousResult": "draw", "timeoutTiebreak": "core-fraction-tower-health-relay-score"}}
  ],
  "evaluation": {"id": "tactical-observations", "version": "0.1.0", "metrics": ["outcome", "response-latency", "objective-tradeoff", "coordination", "interface-quality"], "storage": "local-only", "recordInputs": true, "recordEvents": true},
  "presentation": {"theme": "outdoor-neon-frontier", "camera": "tilted-top-down", "view": "controller"}
}
